App/src/app/artefacts/importances.json

{
  "modele": "Forêt aléatoire",
  "variables": [
    {
      "variable": "Humidity3pm",
      "importance": 0.1406
    },
    {
      "variable": "Pressure3pm",
      "importance": 0.0525
    },
    {
      "variable": "Humidity9am",
      "importance": 0.0482
    },
    {
      "variable": "WindGustSpeed",
      "importance": 0.0479
    },
    {
      "variable": "Pressure9am",
      "importance": 0.0478
    },
    {
      "variable": "Sunshine",
      "importance": 0.0469
    },
    {
      "variable": "Temp3pm",
      "importance": 0.0443
    },
    {
      "variable": "MinTemp",
      "importance": 0.0416
    },
    {
      "variable": "MaxTemp",
      "importance": 0.04
    },
    {
      "variable": "Rainfall",
      "importance": 0.0399
    },
    {
      "variable": "Temp9am",
      "importance": 0.0383
    },
    {
      "variable": "Cloud3pm",
      "importance": 0.0317
    },
    {
      "variable": "WindSpeed3pm",
      "importance": 0.0297
    },
    {
      "variable": "WindSpeed9am",
      "importance": 0.0275
    },
    {
      "variable": "RainToday_No",
      "importance": 0.025
    }
  ]
}

Notebooks/md/03_modelisation.md

### 2.2 Forêt aléatoire

num__Humidity3pm      0.1406
    num__Pressure3pm      0.0525
    num__Humidity9am      0.0482
    num__WindGustSpeed    0.0479
    num__Pressure9am      0.0478
    num__Sunshine         0.0469
    num__Temp3pm          0.0443
    num__MinTemp          0.0416
    num__MaxTemp          0.0400
    num__Rainfall         0.0399
    num__Temp9am          0.0383
    num__Cloud3pm         0.0317
    num__WindSpeed3pm     0.0297
    num__WindSpeed9am     0.0275
    cat__RainToday_No     0.0250
    dtype: float64